{
  "schema_version": "simulation-1",
  "scenario_id": "battery_truck_access_2024",
  "seed": 17,
  "start_at": "2026-10-17T09:00:00-07:00",
  "horizon_minutes": 240,
  "provenance": {
    "kind": "synthetic",
    "description": "Compressed hypothetical exercise; historical sources explain background only, never resource counts or timings.",
    "source_refs": [
      "lafd_battery_2024",
      "pola_reopening_2024",
      "one_fee_notice_2024"
    ]
  },
  "containers_fixture": {
    "path": "fixtures/t49-cohort-100.json",
    "sha256": "497b7631326017a02250d854e80b3f8ad4fa088aae62582897a489b71d6da7b6",
    "mode": "synthetic",
    "overlay_path": "fixtures/t49-cohort-100.operator-overlay.json",
    "overlay_sha256": "a19bc2c6e80ca9963f0546f1b6ff4ee374b8a5487300d41b58abe10195ed8104"
  },
  "planning": {
    "lookahead_minutes": 60,
    "replan_minutes": 5,
    "freeze_minutes": 5
  },
  "resources": [
    {
      "id": "east-lane-1",
      "kind": "gate_lane",
      "capacity": 1,
      "gate": "East",
      "provenance": "synthetic"
    },
    {
      "id": "east-lane-2",
      "kind": "gate_lane",
      "capacity": 1,
      "gate": "East",
      "provenance": "synthetic"
    },
    {
      "id": "west-lane-1",
      "kind": "gate_lane",
      "capacity": 1,
      "gate": "West",
      "provenance": "synthetic"
    },
    {
      "id": "west-lane-2",
      "kind": "gate_lane",
      "capacity": 1,
      "gate": "West",
      "provenance": "synthetic"
    },
    {
      "id": "scale-1",
      "kind": "scale",
      "capacity": 1,
      "gate": "Any",
      "provenance": "synthetic"
    },
    {
      "id": "yard-crew",
      "kind": "crew",
      "capacity": 2,
      "gate": "Any",
      "provenance": "synthetic"
    },
    {
      "id": "reefer-tech",
      "kind": "reefer_technician",
      "capacity": 1,
      "gate": "Any",
      "provenance": "synthetic"
    }
  ],
  "duration_models": {
    "gate_handoff": {
      "distribution": "triangular",
      "minutes": [
        3,
        5,
        9
      ]
    },
    "weight_check": {
      "distribution": "triangular",
      "minutes": [
        6,
        10,
        16
      ]
    },
    "reefer_check": {
      "distribution": "triangular",
      "minutes": [
        5,
        8,
        14
      ]
    }
  },
  "events": [
    {
      "event_id": "battery_truck_access_2024-1",
      "type": "resource.availability",
      "published_at_min": 30,
      "observed_at_min": 32,
      "applies_at_min": 30,
      "provenance": "synthetic",
      "resource_ids": [
        "east-lane-1",
        "east-lane-2"
      ],
      "state": "closed",
      "capacity": 0
    },
    {
      "event_id": "battery_truck_access_2024-2",
      "type": "evidence.update",
      "published_at_min": 45,
      "observed_at_min": 45,
      "applies_at_min": 45,
      "provenance": "synthetic",
      "container_id": "TRXU7731902",
      "namespace": "operator",
      "evidence_id": "hero-evidence-45",
      "patch": {
        "weight": {
          "measured_kg": 16100,
          "declared_kg": 16100,
          "declared_status": "laden",
          "unit": "kg",
          "basis": "container_gross"
        }
      }
    },
    {
      "event_id": "battery_truck_access_2024-3",
      "type": "evidence.update",
      "published_at_min": 60,
      "observed_at_min": 60,
      "applies_at_min": 60,
      "provenance": "synthetic",
      "container_id": "TRXU7731902",
      "namespace": "operator",
      "evidence_id": "hero-evidence-60",
      "patch": {
        "reefer": {
          "temp_c": 2.0,
          "setpoint_c": 2.0
        }
      }
    },
    {
      "event_id": "battery_truck_access_2024-4",
      "type": "resource.availability",
      "published_at_min": 90,
      "observed_at_min": 90,
      "applies_at_min": 90,
      "provenance": "synthetic",
      "resource_ids": [
        "east-lane-1",
        "east-lane-2"
      ],
      "state": "restricted",
      "capacity": 1
    },
    {
      "event_id": "battery_truck_access_2024-5",
      "type": "resource.availability",
      "published_at_min": 120,
      "observed_at_min": 120,
      "applies_at_min": 120,
      "provenance": "synthetic",
      "resource_ids": [
        "east-lane-1",
        "east-lane-2"
      ],
      "state": "open",
      "capacity": 2
    },
    {
      "event_id": "battery_truck_access_2024-6",
      "type": "evidence.update",
      "published_at_min": 140,
      "observed_at_min": 140,
      "applies_at_min": 140,
      "provenance": "synthetic",
      "container_id": "TRXU7731902",
      "namespace": "provider",
      "evidence_id": "hero-evidence-140",
      "patch": {
        "holds_at_pod_terminal": [],
        "available_for_pickup": true,
        "availability_known": true
      }
    }
  ],
  "expected_invariants": [
    "Known holds remain blocking through outages and road recovery.",
    "Verification never implies clearance or cargo quality acceptance.",
    "Only valid completed gate handoffs count as throughput.",
    "No future observations are exposed to policies."
  ]
}
